{
  "$schema": "../spec/scenario-fixtures.schema.json",
  "schema_version": 1,
  "kind": "ufg_scenario_fixtures",
  "contract_files": [
    "spec/release-manifest.schema.json",
    "spec/install-state.schema.json",
    "spec/install-journal.schema.json",
    "spec/state-transitions.json"
  ],
  "scenarios": [
    {"id": "fresh-agp-install", "description": "Exact compatible AGP layout accepts fresh UFG installation.", "operation": "install", "initial": {"target_root_kind": "fixture_binaries", "classification_hint": "agp_ready", "ck3_running": false, "target_is_reparse": false, "ancestor_is_reparse": false, "files": [], "state_file": "absent"}, "confirmation_response": null, "expected": {"classification": "agp_ready", "decision": "proceed", "next_state": "managed_ufg", "writes": [{"relative_path": "dxcompiler.dll", "action": "replace"}, {"relative_path": "AWOW Universal Female Generation/awow_ufg.dll", "action": "create"}], "preserves": [{"relative_path": "dxcompiler_original.dll", "action": "preserve"}, {"relative_path": "AGP Native Hook/agp_parenthook.dll", "action": "preserve"}], "quarantines": [], "removes": [], "rollback": {"required": true, "committed_state": false, "restores": ["dxcompiler.dll"]}, "reason": "Fresh UFG install requires exact AGP hashes and writes only UFG-owned artifacts."}},
    {"id": "managed-upgrade-confirmation", "description": "Managed UFG upgrade requires its exact confirmation token.", "operation": "install", "initial": {"target_root_kind": "fixture_binaries", "classification_hint": "managed_ufg", "ck3_running": false, "target_is_reparse": false, "ancestor_is_reparse": false, "files": [], "state_file": "valid"}, "confirmation_response": null, "expected": {"classification": "managed_ufg", "decision": "abort", "next_state": "managed_ufg", "writes": [], "preserves": [], "quarantines": [], "removes": [], "rollback": {"required": false, "committed_state": false, "restores": []}, "reason": "UPGRADE_UFG_IN_PLACE is required before replacing UFG-owned files."}},
    {"id": "manual-adoption-confirmation", "description": "Exact manual UFG layout can be adopted explicitly.", "operation": "install", "initial": {"target_root_kind": "fixture_binaries", "classification_hint": "manual_ufg", "ck3_running": false, "target_is_reparse": false, "ancestor_is_reparse": false, "files": [], "state_file": "absent"}, "confirmation_response": null, "expected": {"classification": "manual_ufg", "decision": "abort", "next_state": "manual_ufg", "writes": [], "preserves": [], "quarantines": [], "removes": [], "rollback": {"required": false, "committed_state": false, "restores": []}, "reason": "ADOPT_UFG_LAYOUT is required before claiming ownership of manual files."}},
    {"id": "proxy-only-reenable", "description": "Proxy-only state requires explicit re-enable confirmation.", "operation": "install", "initial": {"target_root_kind": "fixture_binaries", "classification_hint": "ufg_proxy_only", "ck3_running": false, "target_is_reparse": false, "ancestor_is_reparse": false, "files": [], "state_file": "valid"}, "confirmation_response": null, "expected": {"classification": "ufg_proxy_only", "decision": "abort", "next_state": "ufg_proxy_only", "writes": [], "preserves": [{"relative_path": "dxcompiler.dll", "action": "preserve"}], "quarantines": [], "removes": [], "rollback": {"required": false, "committed_state": false, "restores": []}, "reason": "RE_ENABLE_UFG is required before recreating the payload."}},
    {"id": "proxy-only-cross-release-upgrade", "description": "A changed-hash UFG release replaces the exact state-owned old UFG proxy and restores the payload only after upgrade confirmation.", "operation": "install", "initial": {"target_root_kind": "fixture_binaries", "classification_hint": "ufg_proxy_only", "ck3_running": false, "target_is_reparse": false, "ancestor_is_reparse": false, "files": [], "state_file": "valid"}, "confirmation_response": "UPGRADE_UFG_IN_PLACE", "expected": {"classification": "ufg_proxy_only", "decision": "proceed", "next_state": "managed_ufg", "writes": [{"relative_path": "dxcompiler.dll", "action": "replace"}, {"relative_path": "AWOW Universal Female Generation/awow_ufg.dll", "action": "create"}], "preserves": [{"relative_path": "dxcompiler_original.dll", "action": "preserve"}, {"relative_path": "AGP Native Hook/agp_parenthook.dll", "action": "preserve"}], "quarantines": [], "removes": [], "rollback": {"required": true, "committed_state": false, "restores": ["dxcompiler.dll"]}, "reason": "The old proxy is replaced only when its bytes match valid UFG state and the incoming AGP pairing is exact."}},
    {"id": "agp-replacement-then-ufg-reenable", "description": "After UFG disable and exact AGP replacement, the matching UFG release may replace the standalone AGP proxy and restore UFG.", "operation": "install", "initial": {"target_root_kind": "fixture_binaries", "classification_hint": "ufg_proxy_only", "ck3_running": false, "target_is_reparse": false, "ancestor_is_reparse": false, "files": [], "state_file": "valid"}, "confirmation_response": "RE_ENABLE_UFG", "expected": {"classification": "ufg_proxy_only", "decision": "proceed", "next_state": "managed_ufg", "writes": [{"relative_path": "dxcompiler.dll", "action": "replace"}, {"relative_path": "AWOW Universal Female Generation/awow_ufg.dll", "action": "create"}], "preserves": [{"relative_path": "dxcompiler_original.dll", "action": "preserve"}, {"relative_path": "AGP Native Hook/agp_parenthook.dll", "action": "preserve"}], "quarantines": [], "removes": [], "rollback": {"required": true, "committed_state": false, "restores": ["dxcompiler.dll"]}, "reason": "A valid disabled UFG state plus the exact new CK3, original compiler, AGP proxy, and AGP payload hashes authorizes the rebase."}},
    {"id": "managed-uninstall-leaves-proxy", "description": "Managed uninstall removes payload and records proxy-only state.", "operation": "uninstall", "initial": {"target_root_kind": "fixture_binaries", "classification_hint": "managed_ufg", "ck3_running": false, "target_is_reparse": false, "ancestor_is_reparse": false, "files": [], "state_file": "valid"}, "confirmation_response": null, "expected": {"classification": "managed_ufg", "decision": "proceed", "next_state": "ufg_proxy_only", "writes": [{"relative_path": "dxcompiler.dll", "action": "preserve"}], "preserves": [{"relative_path": "dxcompiler_original.dll", "action": "preserve"}, {"relative_path": "AGP Native Hook/agp_parenthook.dll", "action": "preserve"}], "quarantines": [], "removes": [{"relative_path": "AWOW Universal Female Generation/awow_ufg.dll", "action": "remove"}], "rollback": {"required": true, "committed_state": false, "restores": ["AWOW Universal Female Generation/awow_ufg.dll"]}, "reason": "UFG uninstall never restores or replaces the active UFG proxy; AGP must continue loading."}},
    {"id": "proxy-only-uninstall-noop", "description": "Repeated uninstall of proxy-only state is a no-op.", "operation": "uninstall", "initial": {"target_root_kind": "fixture_binaries", "classification_hint": "ufg_proxy_only", "ck3_running": false, "target_is_reparse": false, "ancestor_is_reparse": false, "files": [], "state_file": "valid"}, "confirmation_response": null, "expected": {"classification": "ufg_proxy_only", "decision": "no_op", "next_state": "ufg_proxy_only", "writes": [], "preserves": [], "quarantines": [], "removes": [], "rollback": {"required": false, "committed_state": false, "restores": []}, "reason": "The payload is already disabled and the active UFG proxy remains untouched."}},
    {"id": "incompatible-agp-refusal", "description": "An unrecognized AGP proxy or payload is a safe refusal.", "operation": "install", "initial": {"target_root_kind": "fixture_binaries", "classification_hint": "unknown_conflicting", "ck3_running": false, "target_is_reparse": false, "ancestor_is_reparse": false, "files": [], "state_file": "absent"}, "confirmation_response": "I_UNDERSTAND_UNKNOWN_CONFLICT", "expected": {"classification": "unknown_conflicting", "decision": "reject", "next_state": "unknown_conflicting", "writes": [], "preserves": [], "quarantines": [], "removes": [], "rollback": {"required": false, "committed_state": false, "restores": []}, "reason": "UFG cannot safely replace an incompatible or drifted AGP installation."}},
    {"id": "running-game-refusal", "description": "A running CK3 process blocks all mutation.", "operation": "install", "initial": {"target_root_kind": "fixture_binaries", "classification_hint": "agp_ready", "ck3_running": true, "target_is_reparse": false, "ancestor_is_reparse": false, "files": [], "state_file": "absent"}, "confirmation_response": null, "expected": {"classification": "agp_ready", "decision": "reject", "next_state": "agp_ready", "writes": [], "preserves": [], "quarantines": [], "removes": [], "rollback": {"required": false, "committed_state": false, "restores": []}, "reason": "The ck3_not_running guard runs before any stage or mutation."}}
  ]
}
